{
  "schema": 1,
  "id": "t01-text",
  "title": "T01 text and fonts",
  "menu": "Render tests",
  "widgets": [
    {
      "type": "label",
      "x": 8,
      "y": 8,
      "text": "Font 12 - the quick brown fox",
      "font": 12
    },
    {
      "type": "label",
      "x": 8,
      "y": 28,
      "text": "Font 16 - the quick brown fox",
      "font": 16
    },
    {
      "type": "label",
      "x": 8,
      "y": 54,
      "text": "Font 24 - quick brown",
      "font": 24
    },
    {
      "type": "label",
      "x": 8,
      "y": 90,
      "text": "Font 32 - quick",
      "font": 32
    },
    {
      "type": "label",
      "x": 8,
      "y": 140,
      "text": "Red",
      "font": 24,
      "color": "#ff4d4d"
    },
    {
      "type": "label",
      "x": 80,
      "y": 140,
      "text": "Green",
      "font": 24,
      "color": "#3fdc6c"
    },
    {
      "type": "label",
      "x": 180,
      "y": 140,
      "text": "Blue",
      "font": 24,
      "color": "#4aa3ff"
    },
    {
      "type": "label",
      "x": 8,
      "y": 190,
      "text": "Digits 0123456789 .:/-+%",
      "font": 16
    }
  ]
}
